{"abi":"norn.function-abi/1","bounds":{"maxCpuMillis":100,"maxDecodedBytes":65536,"maxInputBytes":65536,"maxMemoryBytes":16777216,"maxOutputBytes":4096,"maxWallMillis":250},"cache":"action_cache","capabilities":[],"dependencyClosure":{"digest":"sha256:53c8389f49199c7b5fa1827158b959bd18244eec31f20ba9fc1f95b731a745b5","entries":[{"digest":"sha256:19a3a346f5e2cdb656b2482b90000f4b434bd69059842583bd832c01be51d34b","kind":"asset","name":"intent-lexicon-en-ar"}]},"determinism":{"qualified_wasm":{"floatPolicy":"canonical_nan","freshInstance":true,"fuel":10000000,"importClosure":[],"maxModuleBytes":4194304,"maxStackBytes":1048576,"simd":false,"threads":false}},"errorSchema":{"digest":"sha256:4ea7789c63be3a99f00bcb7ccd370f6a47e40760cf5eb2c8bea3a804957ebb97","id":"norn.function.error","version":1},"functionId":"norn.classify.whatsapp-intent","implementation":{"digest":"sha256:50ab0481ed5f651c16c2d28b458ef63e9439a4bd6870ceec4c7e0554f62aa890","entryPoint":"classify","format":"wasm_module","locator":null},"inputSchema":{"digest":"sha256:0f97bd0c600fab8dd2e71ce01732d9ef8f6d3a8465642a79f26c189d0d5a7eb2","id":"norn.classify.message-input","version":1},"outputSchema":{"digest":"sha256:dfaa8542ec1c2606ca553895a0e558cee208c0ce1e4df52dabd05b646a3f75c0","id":"norn.classify.intent-output","version":1},"platform":{"arch":"wasm32","os":"none"},"retention":"ledger","runtime":{"digest":"sha256:a0198cff775e4ab78371b0ce027929db16f21f9574226f59927ad49c6abc5bc0","id":"wasmtime","version":"38.0.4"},"steps":[],"version":1}
